{
  "response_type": "aop_resolve_response",
  "request": {
    "object_id": "urn:aop:tool:file-search:v1",
    "object_version": "v1"
  },
  "status": "resolved",
  "record": {
    "object_id": "urn:aop:tool:file-search:v1",
    "object_version": "v1",
    "digest": {
      "algo": "sha256",
      "value": "aaaaaaaaaaaaaaaaaaaaaaaaaaaaaaaaaaaaaaaaaaaaaaaaaaaaaaaaaaaaaaaa"
    },
    "locations": [
      "https://registry.example.com/objects/urn:aop:tool:file-search:v1"
    ]
  },
  "verification": {
    "digest": {
      "algo": "sha256",
      "value": "aaaaaaaaaaaaaaaaaaaaaaaaaaaaaaaaaaaaaaaaaaaaaaaaaaaaaaaaaaaaaaaa"
    },
    "signature_ref": "https://registry.example.com/signatures/urn:aop:tool:file-search:v1.sig"
  }
}
